romaji_title,english_title,native_title,description,genres,episodes,start_date,end_date,average_score,popularity,image_url
Yoshinaga-sanchi no Gargoyle,Gargoyle of Yoshinaga House,吉永さん家のガーゴイル,"Based on the novel by Taguchi Sennendou.
<br><br>Winning the lottery can completely change a person’s life, as Futaba soon discovers. Instead of amassing an instant fortune, however, she obtains a stone gargoyle who proclaims itself the gatekeeper of the Yoshinaga household.<br><br>(Source: HIDIVE)","Comedy, Fantasy",13.0,2006-4-2,2006-6-25,66.0,1378,https://s4.anilist.co/file/anilistcdn/media/anime/cover/large/bx965-wSNF2I6OyOjL.png
Crayon Shin-chan,Shin Chan,クレヨンしんちゃん,"Crayon Shin-chan follows the wacky antics and adventures of five-year-old Shinnosuke ""Shin"" Nohara and his parents, neighbors, and friends and is set in Kasukabe, Saitama Prefecture, Japan.<br><br>
Many of the jokes in the series stem from Shin-chan's occasionally weird, unnatural and inappropriate use of language, as well as from his inappropriate behavior. A typical gag involves Shin-chan confounding his parents by using the wrong phrase for the occasion; for example, saying ""Welcome back!"" instead of ""I am back!"" when he comes home.<br><br>
During the beginning of the series, the TV show was mostly based on the storyline in the original manga. As the show progressed, more and more episodes became anime-original.","Comedy, Ecchi, Slice of Life",,1992-4-13,,77.0,16522,https://s4.anilist.co/file/anilistcdn/media/anime/cover/medium/b966-QUCdKAk4ls9J.jpg
Hokuto no Ken,Fist of the North Star,北斗の拳,"Nuclear war has devastated the planet, turning one fertile ground into a barren, inhospitable landscape on which mankind struggles desperately to stay alive. Society has collapsed and a fight for control wages between vicious dictators, super-powerful mutants, and biker gangs that terrorize the streets.<br>
<br>
In a world so cruel and bleak, only the chosen one can restore civilization to its former self. Kenshiro - master of the Hokuto Shinken fighting technique; a martial art so awesomely brutal that only a single being can be entrusted with its full power!<br>
<br>
(Source: Manga Entertainment)","Action, Drama, Sci-Fi",109.0,1984-10-4,1987-3-5,76.0,28065,https://s4.anilist.co/file/anilistcdn/media/anime/cover/medium/n967-84jNBaInec98.png
Fighting Beauty Wulong REBIRTH,Fighting Beauty Wulong Rebirth,格闘美神 武龍[ウーロン] REBIRTH,"Mao Lan continues growing into her path in life through what she learns while fighting. Her grandfather thinks that she has grown complacent and decides to train an adversary for her next Prime Mat appearance. Training with her friends and companions Mao Lan slowly advances through life.<br><br>
(Source: AniDB)","Action, Comedy",25.0,2006-4-2,2006-10-1,57.0,792,https://s4.anilist.co/file/anilistcdn/media/anime/cover/medium/968.jpg
Tsubasa Chronicle 2nd Season,Tsubasa RESERVoir CHRoNiCLE 2nd Season,ツバサ・クロニクル 第2シリーズ,"Syaoran, Sakura, Kurogane, Fai and Mokona's journey through to different world's continue as they search for Sakura's feathers. The fated journey slowly becomes more complicated for our travelers, as they find themselves diving deeper into more dangerous worlds. Takes place immediately after the first season. Based on the manga by CLAMP.","Adventure, Drama, Fantasy, Mystery, Romance",26.0,2006-4-29,2006-11-4,71.0,14851,https://s4.anilist.co/file/anilistcdn/media/anime/cover/large/bx969-5p26f5cQ6dku.jpg
Yokoyama Mitsuteru Sangokushi,Yokoyama Mitsuteru Sangokushi,横山光輝 三国志,"Around 1800 years ago in China, the ruling power of the Han dynasty became weakened and the flames of war spread throughout the land. <br><br>
Liu Bei was a young, poor straw-mat seller from the countryside of Hebai Hsing. After pledging eternal brotherhood with the two heroes, Guan Yu and Zhang Fei, Liu began building his idea of a righteous kingdom that would aid citizens who suffered from persecution. <br><br>
(Source: AniDB)",Adventure,47.0,1991-10-18,1992-9-25,64.0,1632,https://s4.anilist.co/file/anilistcdn/media/anime/cover/medium/970-doUTAQp8zx9m.png
Astro Boy Tetsuwan Atom,Astro Boy (2003),アストロボーイ・鉄腕アトム,"Atom is a robotic boy that posses super human powers and an artificial intelligence system that is unparalleled to any robot. His creator, Dr. Tenma, created him to replace his late son, Tobio. Dr. Tenma soon destroys his laboratory, after the creation of Atom, and shuts down Atom. Soon after, Dr. Ochanomizu, the head of the Ministry of Science revives Atom, and tries to give him a normal life as a 6th grade student that helps the police agency keep renegade robots and bigot humans from causing harm. Atom faces extreme racism for being a robot, and he must discover the truth about his creator Dr. Tenma.
<br><br>
(Source: Anime News Network)","Action, Adventure, Mecha, Sci-Fi",50.0,2003-4-6,2004-3-28,70.0,6452,https://s4.anilist.co/file/anilistcdn/media/anime/cover/large/nx971-zUOKQLxg0pL2.jpg
Shinshaku Sengoku Eiyuu Densetsu: Sanada Juu Yuushi The Animation,Shinshaku Sengoku Eiyuu Densetsu: Sanada Juu Yuushi The Animation,新釈 戦国英雄伝説 眞田十勇士 The Animation,"In the Fifth Year of the Keicho era, the Tokugawa clan sought to solidify their control of Japan. Hidetada Tokugawa has come to the doorsteps of Ueda Castle with the intentions of having the Sanada clan open its doors to him. But the Sanada and their retainers have other plans...
<br><br>
(Source: Anime News Network)","Action, Comedy",12.0,2005-5-7,2005-7-23,47.0,496,https://s4.anilist.co/file/anilistcdn/media/anime/cover/medium/b988-pxSq2eJE9WDG.jpg
Kamisama Kazoku,God Family,神様家族,"Samatarou is not just an average high-school boy, the truth is that he is the son of a god, his mother is a goddess and his sisters are candidates to become goddesses. They are living in the human world, because they want their boy learn about the human customs and the habits of the creatures that they are protecting, so that in this way Samatarou will become a better god. Tenko is a angel assigned to look after Samatarou. She's born the same day, same year as Samatarou and have been close friends ever since. Life seems normal but things start to change with the appearance of a transfer student named Kumiko. Samatarou falls in love with her and from now on, things will be a lot more different for him. His decision of making her fall in love with him without using his powers will put him in trouble. <br>","Comedy, Drama, Fantasy, Romance",13.0,2006-5-18,2006-8-10,67.0,7437,https://s4.anilist.co/file/anilistcdn/media/anime/cover/large/bx990-KyGlBfHi16sA.png
Dual! Parallel Lunlun Monogatari,Dual! Parallel Trouble Adventure,デュアル！ぱられルンルン物語,"Kazuki Yotsuga is your regular average nerd in high-school, except he isn't smart. He has this website which relates to his visions that only he can see. His vision's are about robots who keep fighting each other battle after battle. One day he is sent to a, ""parallel world"" where these visions exist and he joins a company to fight back against the devious RaRa, who want to take over the world. <br><br>
(Source: Anime News Network)","Action, Comedy, Mecha, Sci-Fi",13.0,1999-4-8,1999-7-1,66.0,3721,https://s4.anilist.co/file/anilistcdn/media/anime/cover/medium/992.jpg
Bishoujo Senshi Sailor Moon: Sailor Stars,Sailor Moon Sailor Stars,美少女戦士セーラームーン セーラースターズ,"Like the R Season, SailorStars is divided into two arcs:<br><br>
The first arc solves some conflicts from the SuperS season, and also sees the return of the Outer Senshi, Haruka, Michiru, Setsuna, and Hotaru (now reborn as a child).<br><br>
The second arc is the actual plot from the manga. Usagi bids farewell to Mamoru, who is going to America to study abroad. In his place comes the Three Lights, an idol trio consisting of three boys, Seiya, Taiki, and Yaten. The new enemy is Galaxia, a woman who desires to rule the entire galaxy by collecting the Star Seeds of humans. Three new Senshi appear, the Sailor Starlights, who also intend to stop Galaxia without Sailormoon's help.","Action, Adventure, Comedy, Drama, Fantasy, Mahou Shoujo, Romance",34.0,1996-3-9,1997-2-8,77.0,21163,https://s4.anilist.co/file/anilistcdn/media/anime/cover/large/bx996-lHMuAdqP4ReE.jpg
BLUE SEED,Blue Seed,BLUE SEED,"Momiji is an average girl until the day she finds she is the descendant of the great Kushinada family. Only she, with her Kushinada blood, can stop the Aragami, demonic plant-like monsters threatening to destroy Japan. Along to help her is the TAC, and a possible love interest in a young man named Kusanagi.
<br><br>
(Source: Anime News Network)
<br>","Action, Adventure, Comedy, Drama, Mystery",26.0,1994-10-5,1995-3-29,65.0,5934,https://s4.anilist.co/file/anilistcdn/media/anime/cover/large/bx998-sd9hvMtHysHW.jpg
Uchuu Kaizoku Captain Harlock,Captain Harlock Space Pirate,宇宙海賊キャプテンハーロック,"The year is 2977. Mankind has become complacent and stagnant. All work is done by machines, while humans spend all their time on entertainment. But when a mysterious invader from the stars catches Earth unawares, only the legendary space pirate Captain Harlock and the crew of the Arcadia have the will to stand against them. <br><br>
(Source: Anime News Network)","Action, Adventure, Drama, Sci-Fi",42.0,1978-3-14,1979-2-13,73.0,10302,https://s4.anilist.co/file/anilistcdn/media/anime/cover/medium/1000-dxR1NyPZXVbm.png
Star Ocean EX,Star Ocean EX,スターオーシャンEX,"Claude C. Kenni, a crewmember on the spaceship Calnus and son of the commander of the ship, is transported to Expel, a backwards planet with swords and magic. He teams up with Rena Lanford, who thinks he is the legendary Warrior of Light, and other characters to investigate the Sorcery Globe, a meteorite that has been causing problems all over the world. <br><br>
(Source: Anime News Network)","Adventure, Fantasy, Sci-Fi",26.0,2001-4-3,2001-9-25,62.0,2222,https://s4.anilist.co/file/anilistcdn/media/anime/cover/medium/b1005-89XftvNxA3rU.jpg
Majutsushi Orphen,Orphen,魔術士オーフェン,"Six years ago at the magic school known as the Tower of Fang, a grave accident happened involving the magical sword Baltanders and the magic user Azali. Unable to control the sword's power, Azali was transformed into the shape of a great dragon who since that day became known as Bloody August. Krilancelo, a young magician at the Tower who cared greatly for Azali found much to his disgust that the elders of the Tower of Fang were less than willing to save Azali and wanted rather to pretend the accident never happened. Angered by their stand, Krilanceloa swore that he would find a way to return Azali to her former self. Thus he forsook the name Krilancelo and declared himself Orphen, leaving the Tower and his magical studies behind to wander the world...
<br><br>
(Source: Anime News Network)","Action, Adventure, Comedy, Fantasy",24.0,1998-10-3,1999-3-27,67.0,9450,https://s4.anilist.co/file/anilistcdn/media/anime/cover/large/nx1017-tPKIClRY3XhN.jpg
Majutsushi Orphen: Revenge,Orphen 2: Revenge,魔術士オーフェンRevenge,"Orphen and his gang has set out on an all new adventure with many monsters to battle and no peace and quiet. But a new friend has joined the group. Her name Lycorus who was sent to find Orphen. Many mysterious shadows are overhanging over head.
<br><br>
(Source: Anime News Network)","Adventure, Comedy, Fantasy",23.0,1999-10-2,2000-3-26,65.0,3454,https://s4.anilist.co/file/anilistcdn/media/anime/cover/medium/b1018-0Yyp7Uf8KfM4.jpg
Honoo no Mirage,Mirage of Blaze,炎の蜃気楼[ミラージュ],"Takaya Ohgi is just a typical high school guy who wants nothing more than to protect his best friend and live a normal life. Enter Nobutsuna Naoe, an older man who informs Takaya that he is in fact the reincarnation of Lord Kagetora. Naoe, himself a possessor, awakens Takaya's abilities to exorcise evil spirits and fight the Fuedal Underworld. While most possessors remember their former lives before being reincarnated, Takaya does not. Naoe is thankful for this, considering his passionate and abusive past with his Lord Kagetora. As Takaya improves his abilities , he also begins to remember what Naoe did because of his love for him. Meanwhile the dark forces of the Hojo and Fuma clans begin their attack as the Fuedal Underworld descends upon the living world. <br><br>
(Source: Anime News Network)","Action, Drama, Romance, Supernatural",13.0,2002-1-7,2002-4-8,57.0,3490,https://s4.anilist.co/file/anilistcdn/media/anime/cover/medium/1019.jpg
Kaikan Phrase,Kaikan Phrase,快感 フレーズ,"After the break up of their old band, guitarist Yuki &amp; drummer Santa decide to form a new one. They recruit bass player Towa, young guitarist Atsuro, and after much persuasion, vocalist Sakuya. Together they form Lucifer and they struggle to make it in the music business, and also to stay together. As well, they have to deal with personal issues, such as parental objections, and watching their old bands succeed ahead of them. Sakuya is the most troubled band member, as he has to deal with his tragic past, and his relationship with teenaged lyricist Aine. <br>","Drama, Music, Romance",44.0,1999-4-20,2000-3-25,63.0,2092,https://s4.anilist.co/file/anilistcdn/media/anime/cover/medium/1021.jpg
Generator Gawl,Generator Gawl,ジェネレイターガウル,"Ryo, Gawl and Koji are 3 young boys who travel back into the past with only 1 objective: change history. In their time they discover that their country, Kubere, uses genetically enhanced persons called generators as a military tool. These generators are the cause for the Third War which kills most of the human population. Now Koji, Ryo and Gawl are there to change all the events.
<br><br>
(Source: Anime News Network)","Action, Adventure, Comedy, Drama, Sci-Fi",12.0,1998-10-7,1998-12-23,64.0,2290,https://s4.anilist.co/file/anilistcdn/media/anime/cover/large/bx1022-1GV26I8THCF0.jpg
Kachou Ouji,The Legend of Black Heaven,課長王子,"Ouji Tanaka has a wife, a child and a mundane job as a salary man in Tokyo's modern society. But life wasn't dull for him to begin with; 15 years ago, he was known as ""Gabriel"", leader of a short-lived heavy metal band called Black Heaven. Ouji's life gets a sudden change in direction when he is invited by a mysterious blonde woman named Layla to pick up his Gibson Flying V and once again display his ""legendary"" guitar skills, not knowing that his music generates power for a massive weapon in an intergalactic war.
<br><br>
(Source: Anime News Network)","Adventure, Comedy, Music, Sci-Fi, Slice of Life",13.0,1999-7-8,1999-10-7,66.0,8076,https://s4.anilist.co/file/anilistcdn/media/anime/cover/large/bx1025-f9yZiEWi0LjY.png
Saint Beast,Saint Beast,セイント・ビースト～聖獣降臨編～,"The seal which was imprisoning the fallen angels, Kirin no Yuda and Houou no Ruka, is broken and the two decide to get revenge on the God who had cast them to Hell by getting rid of the Heavens that had once been their home. Soon the guardian angels on Earth begin disappearing, and no one in Heaven can explain the happenings. But there is a sense of a vengeful animal spirit at work, and so the four Saint Beasts are called upon to investigate.<br><br>
The 4 Gods of Beasts attempt to rescue the guardian angels, as well as to find out what this evil animal spirit is...<br><br>
(Source: Wikipedia)","Action, Fantasy",6.0,2003-5-8,2003-6-13,54.0,1530,https://s4.anilist.co/file/anilistcdn/media/anime/cover/medium/1037.jpg
Mizuiro Jidai,Mizuiro Jidai,水色時代,"Yuuko is a shy middle school girl who has feelings for her childhood friend, the boy next door. When she finds out that her best friend also likes him, she is unsure what to do. The story explores the relationships between these three characters as they confront everyday junior high problems.
<br><br>
(Source: Anime News Network)","Romance, Slice of Life",47.0,1996-4-4,1997-2-27,66.0,1640,https://s4.anilist.co/file/anilistcdn/media/anime/cover/medium/1040.jpg
Elf wo Karu Mono-tachi,Those Who Hunt Elves,エルフを狩るモノたち,"The elves of Middle Earth never faced a foe as terrifying, as determined, as down right demented as Those Who Hunt Elves. Strongman Junpei, Hollywood actress Airi, teenage Ritsuko and their T-74 tank have landed in a (different) world of elves, and the spell to send them home has run amuck and split into five pieces that appear as tattoos on the bodies of five young female elves. So they set out on a quest to strip every elf they can lay their hands on until they find the missing spell pieces. Get ready for the wildest, craziest fantasy ever animated as Those Who Hunt Elves prove that elf stripping is more than just a job; it's an adventure!<br>
<br>
(Source: Sentai Filmworks)","Adventure, Comedy, Ecchi, Fantasy",12.0,1996-10-4,1996-12-20,66.0,5873,https://s4.anilist.co/file/anilistcdn/media/anime/cover/medium/b1045-JFyFjdbqX0o3.jpg
Elf wo Karu Mono-tachi II,Those Who Hunt Elves II,エルフを狩るモノたち II,"After Junpei botched the second attempt to transport back to Japan, the four embark their journey once again to collect runes imprinted on skin of Elven females by stripping them. Celsia is cursed into the form of another animal this time.
<br><br>
(Source: Anime News Network)","Adventure, Comedy, Fantasy",12.0,1997-10-1,1997-12-24,66.0,2548,https://s4.anilist.co/file/anilistcdn/media/anime/cover/large/bx1046-MtFdMlw6oGWL.jpg
The SoulTaker: Tamashiigari,The SoulTaker,The SoulTaker ～魂狩～,"After the human colony on the moon was destroyed by disease, Kyosuke Date and his mother flee to Earth- separated from their family. They take refuge in a cathedral where his mother hides as a nun for reasons unknown to Kyosuke. After dangerous people find their sanctuary, his mother stabs him before she herself is murdered.<br><br>
Days later, Kyosuke finds himself alive and in the house of a mysterious girl who claims to be his twin Runa- and she is not the only one! Runa suffered a similar fate at the hands of her adoptive mother; however her soul was divided into several pieces making ""flicker girls"" who are being hunted by the evil Kirihara Group. The reason Kyosuke survived: his body's DNA conformed to the disease and he is able to transform into a fearsome alien mutant known as the SoulTaker.<br><br>
Kyosuke begins his battle against a hospital of evil mutants and dangerous corporate assassins in order to save himself and the sister he has never known. ","Action, Horror, Supernatural",13.0,2001-4-4,2001-7-4,59.0,6884,https://s4.anilist.co/file/anilistcdn/media/anime/cover/large/bx1048-Moj6UpnnUwBr.jpg
Bobobo-bo Bo-bobo,Bobobo-bo Bo-bobo,ボボボーボ・ボーボボ,"Bo Bobo is a man with the incredible power of hearing the voices of hair and using his own to fight. He uses his power to fight off the Margarita Empire and all of Emperor Tsuru Tsuruiina's minions who are stealing the hair off of anyone they find to power up their emperor. <br><br>
(Source: Anime News Network)","Adventure, Comedy, Sci-Fi",76.0,2003-11-8,2005-9-30,71.0,18563,https://s4.anilist.co/file/anilistcdn/media/anime/cover/large/bx1050-qQAPEPu1kNKP.jpg
Touch,Touch,タッチ,"The story centers around three characters - Uesugi Kazuya, his twin older brother Tatsuya, and Asakura Minami. Kazuya is the darling of his town as he's talented, hardworking, and the ace pitcher for his middle school baseball team. Tatsuya is a hopeless slacker who's been living the life of giving up the spotlight to Kazuya, despite the fact that he may be more gifted than him. Minami is the beautiful childhood girlfriend and for all intents, sister from next door who treats both of them as equals. Society largely assumes Kazuya and Minami will become the perfect couple, including Tatsuya. Yet as time progresses, Tatsuya grows to realize that he's willing to sacrifice anything for the sake of his brother, except at the expense of giving up Minami to Kazuya. And thus the story is told of Tatsuya trying to prove himself over his established younger brother, how it affects the relationship between the three, and both brothers' attempts to make Minami's lifelong dreams come true.","Drama, Romance, Slice of Life, Sports",101.0,1985-3-24,1987-3-22,78.0,10906,https://s4.anilist.co/file/anilistcdn/media/anime/cover/large/bx1065-kwtHZDN5cAOG.jpg
Kishin Houkou Demonbane (2006),Roar of the Machine God Demonbane (2006),機神咆吼デモンベイン,"Kuro Daijuuji is a poor detective living in Arkham City. One day, he was requested by Ruri Hado of Hado Financial Group, to search for a magic book. While he initially refused, Ruri offered him a large sum of money upon completion of her request, in which bribed Kuro to accept. As Kuro searches for the book, he unexpectedly runs into Al, a pretty girl that is actually a powerful grimoire. They forge a contract with each other, bestowing Kuro with powerful magic. Soon afterwards, Al also activates Demonbane, a deus machina owned by the Hado Financial Group, to combat the mechanical menace from the Black Lodge. With this, the war between the Hado Financial Group and the Black Lodge begins....
<br><br>
(Source: Anime News Network)","Action, Ecchi, Mecha, Romance",12.0,2006-5-19,2006-8-18,59.0,5412,https://s4.anilist.co/file/anilistcdn/media/anime/cover/large/bx1067-aOK3mYXFsc9v.jpg
Chou Denji Robo Combattler V,Combattler V,超電磁ロボ コン・バトラーV,"The first of Tadao Nagahama's Romance Super Robot Trilogy. (#2: Chou Denji Machine Voltes V, #3: Toushou Daimos)<br><br>
Thousands of years ago, the people of the planet Campbell decided to leave their planet and seek out new worlds to inhabit. One group, lead by the scientist Oreana, landed on Earth, but was delayed from their mission. In the early 21st century, Oreana's group reawakens and begins their plan to conquer the Earth. The only effective defense against the Campbellians' giant biomechanical slave beasts is the super-electromagnetic robot, Combattler V and its pilots.<br><br>
(Source: AniDB)","Adventure, Mecha, Sci-Fi",54.0,1976-4-17,1977-5-28,65.0,1918,https://s4.anilist.co/file/anilistcdn/media/anime/cover/large/bx1068-IeTNZRIbZ3Na.jpg
Chou Denji Machine Voltes V,VOLTES V,超電磁マシーン ボルテスV,"From out of nowhere, a mysterious alien race known as the Boazan Forces has invaded the Earth. A group of individuals specially trained to handle this kind of situation has been unleashed. Kenichi, Ippei, Daijirou, Hiyoshi &amp; Megumi are the pilots of the Choudenji Machine Voltes V (5), Earth's defense against the Boazan and their terrible Beast Warriors. The plot thickens as the Go Brothers discover their true heritage and the truth behind their father's disappearance. Conflicts and mixed emotions hinder the Go Brothers at times but due to their unwavering desire to find their dad, they must go to the place where it all started. With the help of the rebels based on Earth and on the aliens' homeworld, the Voltes Team has another mission, remove the tyrant Zu Zanbajil and liberate the people of Boazan.
<br><br>
(Source: Anime News Network)","Adventure, Drama, Mecha, Sci-Fi",40.0,1977-6-4,1978-3-25,69.0,2565,https://s4.anilist.co/file/anilistcdn/media/anime/cover/large/bx1069-bNxKpwG1m9JQ.jpg
Love Get CHU: Miracle Seiyuu Hakusho,Love Get CHU: Miracle Seiyuu Hakusho,ラブゲッCHU ～ミラクル声優白書～,"Five girls came to a training school to become voice actresses holding each thought in her mind. Momoko - she wanted to be a voice actress to meet her favorite voice actor. Rinka - she is an armature voice actress, but she didn't have special purpose to become voice actress. Yurika - she likes anime very much. Tsubasa - she was a girl in love, and acted only as a boy. Amane - she found a deadlock as a actress and tried to find another way. They managed to get over the difficulty to become voice actress although they couldn't perform as main characters yet. There is a love romance with a boy works for an anime company, and you can catch a glimpse of situations of anime industries.
<br><br>
(Source: Anime News Network)","Comedy, Romance",25.0,2006-4-5,2006-9-27,60.0,1727,https://s4.anilist.co/file/anilistcdn/media/anime/cover/medium/1070.jpg
