romaji_title,english_title,native_title,description,genres,episodes,start_date,end_date,average_score,popularity,image_url
Kinnikuman Nisei,Ultimate Muscle,キン肉マンII世,"Kid Muscle (or Mantaro for short) is a bumbling, gross, and wimpy sort-of person. Unfortunately, he has been summoned to protect the earth from the evil dMp, a band of cheating wrestlers from outer space. Luckily he's not undertaking this task alone. Kid Muscle must join the Muscle League, a group of wrestlers from outer space who are training themselves so they can defend the earth, and stop the dMp by achieving ""Ultimate Muscle"", a hidden power that makes Mantaro an almost unbeatable opponent.
<br><br>
(Source: Anime News Network)","Action, Comedy, Sci-Fi, Sports",51.0,2002-1-9,2002-12-25,68.0,4859,https://s4.anilist.co/file/anilistcdn/media/anime/cover/medium/1707.jpg
Majuu Sensen: THE APOCALYPSE,Beast Fighter: The Apocalypse,魔獣戦線 THE APOCALYPSE,"An entire city is destroyed by two monstrous and omnipotent beings. Genzou Kuruma, a scientist but also the leader of a sect wishes to awake God, but first, he needs a special kind of blood for it. His son, Shinichi Kuruma, and a young girl, Ayaka Sanders, possess that blood, and he will do anything to capture them and take their blood for God's Awakening, and so, humanity will be lost. Shinichi, along Ayaka and Tomizoro (Tommy), are escaping from Genzou Kuruma's ""New Humans"" (genetically altered humans who can turn into monsters), while Shinichi only wishes for revenge against his father. He, like the other ""New Humans"", has the power to summon different beasts from his body. With this power, he will fight until Genzou Kuruma is killed by his own hands.
<br><br>
(Source: Anime News Network)","Action, Fantasy",13.0,2003-2-23,2003-5-18,51.0,868,https://s4.anilist.co/file/anilistcdn/media/anime/cover/large/bx1708-CRLcERPFVCia.jpg
Rockman.EXE,MegaMan NT Warrior,ロックマン エグゼ,"In the year of 20XX, a young boy by the name of Netto Hikari receives a very special gift as he enters the 5th grade. His very own customized net navi, Rockman! Despite Rockman's small size and far more responsible personality, the two boys quickly become the best of friends. A net navi is designed to guide his operator from the inside of his or her PErsonal Terminal, or simply PET for short. Children and adults alike enjoy friendly ""Net Battles"", where they spar their navis against each other to prove their worth. <br><br>
(Source: Official Site)","Action, Adventure, Comedy, Sci-Fi",56.0,2002-3-4,2003-3-31,65.0,8374,https://s4.anilist.co/file/anilistcdn/media/anime/cover/medium/1710.jpg
Ryuusei Sentai Musumet,Ryuusei Sentai Musumet,流星戦隊ムスメット,"One day, seven shooting stars fell on to the ground. The shooting stars were colored by seven colors, and they had terrible powers. Those who took the shooting star were tuned into monsters by embodying their desires.<br>
Dr. Mishina and Dr. Kishiwada obtained the red, green, and blue stars secretly, and they studied the stars. Finally, they could successfully control their power by putting a special helmet on.<br><br>
The newly developed helmet, ""Musumet"", was as large as an automobile helmet. Putting Musumet on the head, it turned a person's body into the strongest one on the earth. Furthermore, it received the signal from the brain and amplified the inherent power and ability unlimitedly.<br><br>
To utilize the power of ""Musumet"", to keep the world peace, and to protect from the disasters caused by the remaining shooting stars, Dr. Mishima and Dr. Kishida founded a secret organization ""MET"". However, he died before he accomplished his aim.<br><br>
The bereaved daughters, Aoi, Midori, and Kurenai, made up their minds to become Musmet in order to execute the father's will.<br><br>
Even if they turned into Musumet, their wearing wouldn't change except helmets, gloves, and boots. Therefore, they had to go to the scenes wearing their own clothes. The girls had to go to the incident spots occasionally wearing school uniforms, occasionally gymnasium suits, occasionally swimming suits, depending the case, they had to go there even if they were naked, and they would do great jobs. On the other hand, at other times, they were ordinal adolescent girls who were dreaming of lovely meetings with boyfriends.<br><br>
Whether would they cope with the world peace and boyfriends at the same time? <br><br>
(Source: AnimeNfo)","Adventure, Comedy, Ecchi, Romance, Sci-Fi",13.0,2004-10-4,2004-12-27,63.0,943,https://s4.anilist.co/file/anilistcdn/media/anime/cover/medium/1711.jpg
Shin Seiki Den Mars,Shin Seiki Den Mars,神世紀伝　マーズ,"Mars is discovered on a forming volcano island, Heisei; a man with no memory. In reality, Mars is from outer space, and is supposed to gather information to decide whether Earth should be destroyed or not. Along with the giant robot Gaia, and his mysterious images of a woman urging him not to destroy the world, Mars decides to fight for Earth rather than destroy it, even if it means fighting his own kind. But if Mars is killed, Gaia will explode, destroying Earth along with it.
<br><br>
(Source: Anime News Network)","Mecha, Sci-Fi",13.0,2002-10-31,2003-2-6,53.0,679,https://s4.anilist.co/file/anilistcdn/media/anime/cover/large/bx1712-v6gs8NM01x8R.jpg
Submarine Super 99,Submarine Super 99,サブマリン スーパー９９,"Dr. Oki , the genius scientist who designed a new type of submarine is missing. His son, Susumu, smells an evil scheme of unknown group. He knows everything of his father's submarine called ""Super 99"" &ndash; equipment, weapons, functions and capacity. Susumu thinks that to find his father is to reveal the secret organization, Helmet Party, and stop their conspiracy. With the help of his friends and Marine Corps, he sets out to an underwater quest, not knowing how dangerous his endeavour is&hellip;
<br><br>
(Source: Anime News Network)","Action, Adventure, Sci-Fi",13.0,2003-5-8,2003-7-31,66.0,860,https://s4.anilist.co/file/anilistcdn/media/anime/cover/medium/b1713-Ri3Y5SbCpfs4.jpg
Hitohira,Hitohira,ひとひら,"A transfer student Asai Mugi is a painfully shy girl. She is so shy that she can't speak when she becomes seriously nervous. However, for some reason, she is spotted and recruited as a member of the drama club.<br><br>
(Source: AnimeNfo)","Drama, Romance, Slice of Life",12.0,2007-3-28,2007-6-13,63.0,3552,https://s4.anilist.co/file/anilistcdn/media/anime/cover/medium/1721.jpg
Nagasarete Airantou,Nagasarete Airanto,ながされて藍蘭島,"After a terrible argument with his father, Ikuto makes a hasty, fateful decision to run away from home. Going from runaway to stowaway, Ikuto’s luck lands him on a ship heading right into the path of a huge storm! When it rains, it pours — or in Ikuto’s case, it pours so badly that he washes overboard and wakes up on a deserted island. Well, an almost deserted island. The island is populated by nothing but beautiful girls, all of whom want Ikuto to choose them as his bride.<br>
<br>
(Source: HIDIVE)","Comedy, Ecchi, Fantasy, Romance",26.0,2007-4-5,2007-9-27,67.0,17451,https://s4.anilist.co/file/anilistcdn/media/anime/cover/large/bx1722-6ODyx4oSLQIh.png
Saint October,Saint October,セイントオクトーバー,"Whether it is the future or the past it is the world of fantasy and horror hiding in the shadow of the demon city. In the city, consecutive mysterious incidents that cannot be solved by science have occurred. To solve the incidents, they gather three girl detectives possessing special abilities.<br><br>
Hayama Kotono. She is an orphan living in a convent.<br>
Shirafuji Natuski. She is Kotono's classmate and a pop idol.<br>
Hijiri Misaki. She is a mysterious girl who fights against nightmares of her previous life.<br><br>
Those who want to bring the Judgement Day to the world.<br>
Those who want to save the world.<br>
Which is justice, and which is evil?<br><br>
When Kotono encounters a boy who lost his memory, the wheel of the story begins to move but slowly. Then, solving the mysteries, the three girls will confront the fate that will influence the existence of the human beings.<br><br>
(Source: AnimeNfo)","Adventure, Drama, Fantasy, Mahou Shoujo, Mystery",26.0,2007-1-5,2007-6-29,62.0,1989,https://s4.anilist.co/file/anilistcdn/media/anime/cover/large/bx1724-pxRNhkgaSSIR.jpg
Devil May Cry,Devil May Cry,デビル メイ クライ,"Cursed to live as both monster and man, Dante must spend his life fighting the demonic forces of darkness. Brandishing his sword, Rebellion, and his always-loaded guns, Ebony and Ivory, Dante is more than happy to send the demons back to hell—especially when there’s money to be made. The wildly popular video game <i>Devil May Cry</i> is now a series, and this time, there’s no sympathy for the devil. <br><br>
(Source: Crunchyroll, edited)","Action, Fantasy",12.0,2007-6-14,2007-9-6,65.0,46370,https://s4.anilist.co/file/anilistcdn/media/anime/cover/large/bx1726-IrpH32PVADiO.jpg
Shinkyoku Soukai Polyphonica,Polyphonica,神曲奏界ポリフォニカ,"Phoron Tatara's no ordinary musician. As one of the rare Dantists who can summon elder spirits using music called Commandia, his gift is so strong that his spirit partner is none other than the infamous Corticarte Apa Lagranges. Sure, she may look like a young girl in her human form, but you don't get nicknames like ""The Crimson Annihilator"" and ""The Bloody Duchess"" for sitting back and watching the daisies grow.<br><br>
Now, at the behest of the Tsuge Divine Music Player Office, this dynamic duet travels the continent of Polyphonica on Phoron's combination motorcycle/organ, following the song of the open road, orchestrating rescues and generally fixing whatever's baroque! Some musicians wait for a muse to hit them, but Phoron makes his work for scale!<br><br>
(Source: RightStuf)","Drama, Fantasy, Music, Romance",12.0,2007-4-4,2007-6-20,63.0,5475,https://s4.anilist.co/file/anilistcdn/media/anime/cover/large/bx1727-DKAKdTyHqeTK.jpg
Super GALS! Kotobuki Ran,Super GALS,超GALS! 寿蘭,"Sporting designer clothes, make-up, and nails, Ran Kotobuki is the very picture of a trendy, young Shibuya girl, but don't let that fool you. This girl comes from a family of cops, and she&rsquo;s ready to lay you out flat if you even think about causing trouble in her town! At least, she will... when she&rsquo;s not distracted with karaoke, shopping, and dodging her homework. Join Ran and her friends as they defend the streets of Shibuya and attempt to shop their way into the history books as the most famous Gals ever!<br><br>
(Source: RightStuf)","Comedy, Slice of Life",52.0,2001-4-1,2002-3-31,71.0,5864,https://s4.anilist.co/file/anilistcdn/media/anime/cover/large/bx1728-yPtJchXDmoie.png
NARUTO: Shippuuden,Naruto: Shippuden,NARUTO -ナルト- 疾風伝,"Naruto: Shippuuden is the continuation of the original animated TV series Naruto. The story revolves around an older and slightly more matured Uzumaki Naruto and his quest to save his friend Uchiha Sasuke from the grips of the snake-like Shinobi, Orochimaru. After 2 and a half years Naruto finally returns to his village of Konoha, and sets about putting his ambitions to work, though it will not be easy, as he has amassed a few (more dangerous) enemies, in the likes of the shinobi organization; Akatsuki. <br><br>
(Source: Anime News Network)","Action, Adventure, Comedy, Drama, Fantasy, Supernatural",500.0,2007-2-15,2017-3-23,81.0,508953,https://s4.anilist.co/file/anilistcdn/media/anime/cover/large/bx1735-kGfVm0YqCPcu.png
Uchuu Senshi Baldios,Space Warrior Baldios,宇宙戦士 バルディオス,"Marin Reigan lost his father and his home when Gattler staged a coup, forcing their people to abandon their dying planet and invade another. Seeking vengeance, Marin pursued. But when he saw the world they planned to invade, Marin found a new mission: to protect the untarnished skies and seas of that blue planet--Earth!
<br><br>
The battle will not be easy. Marin's technology is the only thing that can stand against Gattler's forces. But the Earthlings are not quick to trust him, and the ruthless enemy commander Aphrodia is hungry for vengeance of her own. Can Marin gain the Earthlings' trust, avenge his father, and stop the war? 
<br><br>
(Source: Discotek Media)<br><br>
<i>Note: Originally planned and scripted for 39 episodes, the series was cancelled with various reasons cited including lack of anime magazine coverage and constant airtime changes. The 31st and last episode to air was actually produced as episode 32. Three unaired completed episodes (31, 33, 34) were later released on LaserDisc/DVD/Blu-ray, and the finished scripts and storyboards for the final 5 episodes had been shared in various magazines and a deluxe book.</I>","Adventure, Drama, Mecha, Sci-Fi",34.0,1980-6-30,1981-1-25,67.0,1414,https://s4.anilist.co/file/anilistcdn/media/anime/cover/large/bx1737-Kto0TF8t1gBw.jpg
Muteki Kanban Musume,Ramen Fighter Miki,無敵看板娘,"Miki Onimaru is a poster girl that works at her mother's Chinese ramen restaurant. She appears to be a normal girl, but she can become very violent if provoked. She picks a fight with her mother and accquaintances as a result on an almost daily basis, causing a series of troubling mishaps in their otherwise normal lives.
<br><br>
(Source: Anime News Network)","Action, Comedy",12.0,2006-7-5,2006-9-20,66.0,4027,https://s4.anilist.co/file/anilistcdn/media/anime/cover/large/bx1738-WHxZGItrsQSl.jpg
Naikaku Kenryoku Hanzai Kyousei Torishimarikan Zaizen Joutarou,Naikaku Kenryoku Hanzai Kyousei Torishimarikan Zaizen Joutarou,内閣権力犯罪強制取締官 財前丈太郎,"After Japan's economic bubble burst the country slowly recovered, but dirty politicians still make deals with dirty businessmen so that they can both profit from the hard work of others. Keiichi Suzuki, head of Oshika Construction, and Seijiro Matsuzaka, one of the members of parliament, have a deal going on that allows Oshika Construction to use fewer materials in their projects while still letting their buildings get approved for business use. Unfortunately for them, the Government Crime Investigation Agency, the Japanese government-approved but independently-run equivalent to the FBI, is already on the move. Jotaro Zaizen, a long-thought-dead police officer, is the agent on the Ōshika case and gathers a group of people who have reasons to fight Suzuki and Matsuzaka. To help combat the GCIA, though, Suzuki hires the Haoukokuryu-kai, a yakuza group.","Action, Drama",11.0,2006-7-6,2006-9-21,50.0,729,https://s4.anilist.co/file/anilistcdn/media/anime/cover/medium/b1740-kjIxWmL0c0qB.png
Wagamama☆Fairy Mirumo de Pon!,Mirmo Zibang!,わがまま☆フェアリー ミルモでポン!,"Kaede is a cheerful and energetic eighth grader. When it comes to boys, however, she is hopelessly shy. <br><br>
One day, on her way home from school, Kaede walks into a mysterious shop and buys a colorful cocoa mug. When she reaches home, she casually peeks into the bottom of the mug and discovers an engraved note, which says, ""If you read this message aloud while pouring hot cocoa into the mug, a love fairy (""muglox"") will appear and grant your every wish."" The skeptical but curious Kaede follows the directions and announces her wish to date Yuuki, the class heartthrob. Suddenly, the adorable blue Mirumo appears! We soon find out, however, that this cute little muglox would rather eat chocolate and create mischief than help Kaede. <br><br>
Mirumo, it seems, is prince of the muglox world. Horrified at the prospect of having to marry Rirumu, his princess bride-to-be, Mirumo has escaped the muglox world. Hot on his heels, however, are Rirumu, Yashichi the bounty hunter, and a cast of hundreds of muglox ranging from the good to the bad to the nutty. This gang of adorable troublemakers will see to it that school life for Kaede and her friends is never the same... <br><br>
(Source: mirmo-zibang) ","Adventure, Comedy, Drama, Fantasy, Mahou Shoujo, Romance",78.0,2002-4-6,2003-9-27,69.0,4286,https://s4.anilist.co/file/anilistcdn/media/anime/cover/medium/1744.jpg
Wild 7 another Bouryaku Unga,Wild 7 Another,ワイルド7 another 謀略運河,"A big transatlantic ship, full of rich and important people for international business, has been taken by a group of terrorists. The only hope for their rescue is in the hands of a Japanese man known as Japa, but first, he must hire seven companions to help him, and together they will be the Wild Seven. The main plot occurs in the waters of Nicaragua's Canal.
<br><br>
(Source: Anime News Network)","Action, Adventure",13.0,2002-4-27,2002-8-31,43.0,444,https://s4.anilist.co/file/anilistcdn/media/anime/cover/medium/1745.jpg
Zoids Fuzors,Zoids Fuzors,ゾイド・フューザース,"R.D. is a delivery boy who works for a company called Mach Storm in order to earn money to search for the legendary Alpha Zoid. A Zoid that he heard rumours about from his dad that he passionately believes in. Mach Storm also doubles as a Zoid Battling team. In R.D.'s first Coliseum Zoid Battle, he encounters a team that can fuse Zoids. R.D. soon discovers that he has a Zoid that can computably fuse with his Zoid, Liger Zero. After this happens R.D.'s adventure to discover the truth about the Alpha Zoid begins.
<br><br>
(Source: Anime News Network)","Adventure, Mecha, Sci-Fi",26.0,2004-10-3,2005-4-3,56.0,1731,https://s4.anilist.co/file/anilistcdn/media/anime/cover/medium/1746.jpg
OH! Super Milk-Chan,The Super Milk-Chan Show,OH! スーパーミルクチャン,"Milk-chan is a drooling, potty-mouthed baby who lives in an apartment with an obsolete robot named Tetsuko, a slug named Hanage, and an uncontrollable pet named Robodog. Whenever the President calls, Milk-chan and the gang rush to the scene to solve any type of problem - whether it's stopping a money counterfeiter hungry for Belgian waffles or counselling a school of drunk fish. At the same time, they have to avoid a nagging landlord, as they're six months behind their rent.
<br><br>
(Source: Anime News Network)","Action, Comedy, Sci-Fi",12.0,2000-1-27,2000-4-13,58.0,1514,https://s4.anilist.co/file/anilistcdn/media/anime/cover/large/bx1769-MGY3oe7BBpD0.jpg
Ring ni Kakero 1: Nichibei Kessen-hen,Ring ni Kakero 1 Episode: The Pacific War,リングにかけろ1 日米決戦編,"Immediately after Ryuuji Takane won the Champion Carnival, the U.S. Junior Champion Black Shaft appeared, and challenged the best Japan has to offer, just before the World Tournament is about to happen. Now Ryuuji, Takeshi Kawai, Kazuki Shinatora, Ishimatsu Katori, and Superstar Jun Kenzaki have to prove to not only Black Shaft, but the world, that they are truly world-class boxers before the World Tournament starts. But Shaft is not recruiting boxers for his challenge, but instead gets a life-timer criminal from Death Row, the leader of the Great Angels, one of the toughest gangs in America, a mysterious woman, and the ""Dark Emperor of the South"". Also, Shaft negotiates with Don Giuliano, the Italian Junior Champion, just in case...
<br><br>
(Source: Anime News Network)","Action, Sports",12.0,2006-4-6,2006-6-12,63.0,744,https://s4.anilist.co/file/anilistcdn/media/anime/cover/large/bx1771-I13QhYgBj6UL.jpg
Jikuu Tenshou Nazca,Dimension Movement of Nazca,時空転抄ナスカ,"Miura Kyoji, a dedicated kendo student, discovers that his shisho (master) Tate Masanari is a reincarnated Incan warrior named Yawaru who wishes to destroy the world to purify it. Kyoji himself is the warrior Bilka, who foiled Yawaru's plans in their previous lives. Yawaru gathers other awakened spirits to release the powers of nature. Now Koyji must wrestle with his own fate and decide if he is merely a vessel for the reincarnated soul or if he is truly Miura Kyoji and which will be better able to save the world and the future as he knows it.
<br><br>
(Source: Anime News Network)","Action, Adventure, Drama, Fantasy",12.0,1998-4-6,1998-6-29,54.0,2194,https://s4.anilist.co/file/anilistcdn/media/anime/cover/medium/1775.jpg
Janggeumiui kkum,Janggeumiui kkum,장금이의 꿈,"Story is about the girl Jang Geum who wants to be a cook. She gets accepted as a palace servant. Clever and cheerful Jang Geum quickly finds friends. But all to soon she encounters intrigue and corruption. <br><br>
A Korean/Japanese joint production.","Adventure, Comedy",26.0,2005-10-29,2006-4-29,63.0,929,https://s4.anilist.co/file/anilistcdn/media/anime/cover/medium/1778.jpg
OVERMAN King Gainer,OVERMAN King Gainer,OVERMANキングゲイナー,"In the distant future, mankind is forced to live in domed cities called Domepolis after an environmental cataclysm. These cities are maintained and supplied by private corporations, but at what cost to the inhabitants living within them? In a Siberian Domepolis, virtual game champion Gainer Sanga is arrested on suspicion of Exodus, an unauthorized venture beyond the dome walls and strictly prohibited by the government.<br>
<br>
In prison, he meets Gain Bijou, a mercenary bent on escaping and together the two will steal a mysterious Overman out of Duke Medaiyu's mansion. Fighting back the Siberian Railway Patrol forces, they both lead a massive Exodus out of the city to the east land Yapan, where their ancestors are originally from.<br>
<br>
(Source: Bandai Entertainment)","Action, Adventure, Mecha, Sci-Fi",26.0,2002-9-7,2003-3-22,69.0,5190,https://s4.anilist.co/file/anilistcdn/media/anime/cover/large/bx1792-G7LtuJsDqpub.jpg
Master Mosquiton '99,Master Mosquiton '99,マスターモスキートン’９９,"Catholic schoolgirl Inaho discovers that a vampire, Mosquiton, is feeding off of her classmates. So she stakes him, but he is revived after her blood comes in contact with the his remains. Mosquiton becomes her slave and also a history teacher. Together, along with Yuuki and Honou, the unlikely duo have many escapades and adventures. One of Inaho's main goals is to find the mythical O-Part to make some money!<br><br>
(Source: AnimeNfo)","Action, Adventure, Comedy",26.0,1997-9-30,1998-3-31,62.0,1027,https://s4.anilist.co/file/anilistcdn/media/anime/cover/large/bx1806-KI05dWohplGd.jpg
Prism Ark,Prism Ark,プリズム・アーク,"The Sablum Empire has been attempting to take over the kingdom of Windland for many years, and are now plotting with the mercenaries Sister Hell and Darkness Knight to start a new offensive using powerful magical beings called Angels. <br><br>
Hyaweh, a carefree yet talented swordsman, and Priecia, who just might be the lost princess of Windland, are enrolled at the Knight's Academy in Windland to hone their skill at swords and sorcery. There they meet many friends and allies who can help them protect their homeland from the impending invasion. ","Action, Comedy, Drama, Ecchi, Fantasy",12.0,2007-10-8,2007-12-24,58.0,3783,https://s4.anilist.co/file/anilistcdn/media/anime/cover/medium/1807.jpg
Kamichama Karin,Kamichama Karin,かみちゃまかりん,"Karin Hanazono is an orphan, living with her relatives. Her life has never been easy, her studies are not well, she is not the best in sports and technically she is miserable. Left with only a ring as a memento from her departed mother, she suddenly finds her life changed, as she was mourning her pet cat, Shii-chan. On that night she met a strange boy, Kazune Kujyou. After that event, she experiences several mysterious incidences that soon led her to find out that she is a little goddess. Finding others like her she soon sets out to understand herself better as her mysterious powers grow and she becomes beset by opponents. <br><br>
(Source: Anime News Network)","Comedy, Fantasy, Mahou Shoujo",26.0,2007-4-6,2007-9-28,66.0,8336,https://s4.anilist.co/file/anilistcdn/media/anime/cover/large/bx1808-5BMJ60nECCfX.png
Kyoshiro to Towa no Sora,Shattered Angels,京四郎と永遠の空,"Kuu attends school in the city of learning, Academia. She soon finds herself locked in conflict with the Absolute Angels: a group of beautiful girls who feed on human life force to survive. Wielding god-like strength, they have the power to destroy the world itself. But are they truly demons of destruction or simply innocent girls trapped in a fate they can’t escape? <br><br>
(Source: Crunchyroll) ","Drama, Romance",12.0,2007-1-5,2007-3-23,57.0,6286,https://s4.anilist.co/file/anilistcdn/media/anime/cover/medium/1810.jpg
Sonic X,Sonic X,ソニックX,"Back on Sonic's home planet, Eggman has collected all 7 of the Chaos Emeralds, and is about to have absolute power when Sonic interferes, causing an explosion that sends everyone from their world to Earth. Sonic and his friends team up with 12 year old Christopher Thorndyke to collect all the Chaos Emeralds and defeat the evil Dr. Eggman.<br><br>
(Source: Anime News Network)","Action, Adventure, Comedy, Fantasy, Mecha, Sci-Fi",52.0,2003-4-6,2004-3-28,64.0,20224,https://s4.anilist.co/file/anilistcdn/media/anime/cover/large/bx1816-yxbOVMuD7SAJ.png
CLAYMORE,Claymore,CLAYMORE,"A brutal scourge stalks the land. Yoma, monsters driven by a hunger satisfied by only one quarry - Humanity. The dark breed knows but a singular foe: Claymore. Human-Yoma hybrids of extraordinary strength and cunning, the Claymores roam from skirmish to skirmish delivering salvation by the edge of a blade.<br>
<br>
Thus begins the twisting tale of Clare, one such sister of the sword driven by pain in both victory and defeat. A child silent and suffering hidden in her past, Clare's march toward vengeance unfolds along a path marked by violence, solitude and scorn. In a land where even the predator is prey, the haunted hearts of hunter and hunted alike wear the scars of the age.<br>
<br>
(Source: Funimation)","Action, Adventure, Fantasy, Horror",26.0,2007-4-4,2007-9-26,73.0,100148,https://s4.anilist.co/file/anilistcdn/media/anime/cover/large/bx1818-KieLJv0qo3mO.jpg
