romaji_title,english_title,native_title,description,genres,episodes,start_date,end_date,average_score,popularity,image_url
Tsukuyomi: MOON PHASE,MoonPhase,月詠 −MOON PHASE−,"Morioka Kouhei wants to become a photographer. Unfortunately, he has the tendency to unintentionally capture the images of ghosts on film.<br><br>
One day, he visits an old castle in Germany where he meets a vampire girl, Hazuki. It turns out that Hazuki is confined in the castle against her will. She tries to turn Kouhei into her slave by sucking his blood, with the intent to have him break the device sealing her in the castle. Although Kouhei proves to be immune to the vampire's curse, he is eventually forced to help her. Hazuki successfully escapes from the castle and leaves for Japan to look for her mother.<br><br>
When she arrives in Japan, she goes to Kohei's house where he lives with his grandfather, who agrees to take in the girl. Due to his own childhood experiences, the sympathetic Kouhei agrees to aid Hazuki in her quest.<br><br>
However, other vampires, including Elfried and Count Kinkell, manage to track Hazuki to Japan. They will stop at nothing to retrieve her.<br><br>
(Source: AnimeNfo)","Comedy, Romance, Supernatural",25.0,2004-10-4,2005-3-28,65.0,13810,https://s4.anilist.co/file/anilistcdn/media/anime/cover/large/bx343-DoAaLkY3ukNe.jpg
Futatsu no Spica,Twin Spica,ふたつのスピカ,"When Kamogawa Asumi was just a baby, her mother was grievously injured when a rocket crashed to the ground. Five years later, having been in a coma all the time, Asumi's mother finally dies, and the little girl struggles to come to terms with the death of a mother she barely remembers. In the midst of her turmoil, she meets ""Lion-san"", a strange figure wearing a lion mask and claiming to be a ghost. Lion-san helps Asumi to bury her mother's ashes, and finally, Asumi reaches her own decision: ""When I grow up, I'm going to be a rocket pilot.""
<br><br>
(Source: Anime News Network)","Drama, Sci-Fi, Supernatural",20.0,2003-11-1,2004-3-27,70.0,2853,https://s4.anilist.co/file/anilistcdn/media/anime/cover/large/bx344-JGnFQAXW7Tob.jpg
Eikoku Koi Monogatari Emma,Emma: A Victorian Romance,英國戀物語エマ,"In 19th-century London, class lines are sharply drawn, and the social standing to which people are born dictates the path their lives will follow. Emma, an honest and hardworking young maid, never felt her place in life to be a burden. But then she met William, a member of the gentry and the eldest son of a wealthy family. His warm smile and earnest affection threaten to capture her heart... but can love truly conquer all?<br><br>
(Source: RightStuf)","Drama, Romance, Slice of Life",12.0,2005-4-3,2005-6-19,74.0,12976,https://s4.anilist.co/file/anilistcdn/media/anime/cover/large/bx345-ItqN2dbXa99S.jpg
Wild Arms: Twilight Venom,Wild Arms: Twilight Venom,ワイルドアームズ トワイライトヴェノム,"This anime is based on a PlayStation game under the same title. The story is about four people who travel the desolated land of Filgaea and carve themselves a legendary story while they`re at it. These adventurers are Sheyenne Rainstorm, a gunslinger who holds the legendary weapon called ARMs; Kiel Aromax, a scientist who looks like he should be carrying a sword; Roleta Oratorio the Crest Sorceress, a magic-user who uses cards called Crests to cast spells; and Mirabelle Graceland, one of the Noble Red, which are a family of vampiric creatures who live alongside human beings They also travel with cute little intelligent furry things, from the Popepi Pipepo Tribe, named Isaac and Jerusha.<br><br>
(Source: AniDB)","Action, Adventure, Fantasy, Sci-Fi",22.0,1999-10-18,2000-3-27,63.0,1679,https://s4.anilist.co/file/anilistcdn/media/anime/cover/large/bx347-9KfBM9H0PSST.jpg
Magical Canan,Magical Kanan,まじかるカナン,"Based on the erotic game by Terios.<br>
<br>
Five dangerous ""seeds"" have been stolen from their vault in the world of Evergreen and taken to Earth. Natsuki, an agent of the Queen, has been sent to retrieve them. However, he cannot do this alone and enlists the aid of Chihaya, a middle school student, who is ""the only one"" who can help him. With his aid she transforms into Magical Warrior Carmine in order to save the humans possessed by the seeds. Questions abound though, such as why Chihaya's mother appears to know all about this secret activity, why Chihaya remembers her father who reportedly died before her birth, and why she dreams of Evergreen, which she has never seen.
<br><br>
(Source: Anime News Network)","Drama, Fantasy, Mahou Shoujo, Supernatural",13.0,2005-1-1,2005-3-26,57.0,1773,https://s4.anilist.co/file/anilistcdn/media/anime/cover/medium/349.jpg
Ojamajo Doremi,Magical DoReMi,おジャ魔女どれみ,"Doremi Harukaze, 3rd grade student at Misora Elementary School, claims to be the world's unluckiest pretty girl. Fascinated by witchcraft, she is drawn into a mysterious shop where she meets Majo Rika and is able to deduce that this lady is in fact a real witch. Being exposed by a human triggers a curse that transforms witches into magical frogs. To regain her original body, Rika must turn Doremi into a witch by teaching her how to use magic. Thrilled by this odd development, Harukaze becomes a witch apprentice. Unfortunately, her two best friends, Hazuki Fujiwara and Aiko Senoo, discover that Doremi has become a magic user. Afraid that Harukaze might become a magical frog too, Majo Rika recruits both Hazuki and Aiko and makes them witch apprentices too. The trio has lots of adventures as they try to triumph the necessary trials to become real witches.<br><br>

(Source: Anime News Network)","Comedy, Drama, Fantasy, Mahou Shoujo, Slice of Life",51.0,1999-2-7,2000-1-30,73.0,17763,https://s4.anilist.co/file/anilistcdn/media/anime/cover/large/bx350-iRi1NOntsTnG.jpg
Ojamajo Doremi Sharp,Ojamajo Doremi Sharp,おジャ魔女どれみ♯,"Upon re-entering the witch world the girls accidentally come by a Blue rose field and witness the birth of the future witch queen: Hana-chan. Due to witnessing her birth the girls are then put in charge of baby Hana-chan and must raise her of their ""mothers"".

But will four ten year old girls be able to raise a baby when they're still children themselves?! Can Pop finally catch up with her older clumsy sister? Will Majorika finally turn back to normal?","Comedy, Drama, Fantasy, Mahou Shoujo, Slice of Life",49.0,2000-2-6,2001-1-28,75.0,6679,https://s4.anilist.co/file/anilistcdn/media/anime/cover/medium/b351-d77vjiz5qpni.png
Motto! Ojamajo Doremi,Motto! Ojamajo Doremi,も〜っと！おジャ魔女どれみ,"After the losing of magical ability to become witches, they once again become them. But, now they have to go through tests from the Witches of the Witch World. They also meet a new member, from New York, U.S. comes Momoko (the yellow Ojamajo). <br><br>
(Source: Anime News Network)","Comedy, Drama, Fantasy, Mahou Shoujo, Slice of Life",50.0,2001-2-4,2002-1-27,76.0,5697,https://s4.anilist.co/file/anilistcdn/media/anime/cover/large/bx352-Wec3x2bp2Y9Z.png
Ojamajo Doremi Dokkaan!,Ojamajo Doremi Dokkaan!,おジャ魔女どれみドッカ〜ン！,"Hana now becomes a peer of the Ojamajo. When Majotourbillon's spirit revives, the witches now have to break her curse. From the help from Pao-chan, Doremi, Hana, and the other witches are able to defeat the curses. <br><br>
(Source: Anime News Network)","Comedy, Drama, Fantasy, Mahou Shoujo, Slice of Life",51.0,2002-2-3,2003-1-26,79.0,5235,https://s4.anilist.co/file/anilistcdn/media/anime/cover/large/bx353-OPqNN0mZ6onZ.jpg
Shakugan no Shana,Shakugan no Shana,灼眼のシャナ,"He had thought his normal days would last forever, until they were ended abruptly by an encounter with a girl with red hair and eyes. He named her Shana.<br><br>
Not long after he enters high school, Sakai Yuji&rsquo;s normal days come to an end. He sees something bizarre on his way home: people are frozen in a strange fire, and a monster that looks like a large doll is attacking them. Just when he's about to be killed, a girl in a dark cloak wielding a large sword appears, and slices the monster in half. Although Yuji survives the strange encounter, the girl informs him of a desolate truth: "" 'You' don't exist anymore.""<br><br>
She calls herself a Flame Haze who hunts ""Guze no Tomogara""; intruders from another world. She explains to him that he is a ""Torch"", a substitute of Yuji whose &ldquo;existence&rdquo; has already been devoured. She also told him that he is a special Torch, ""Mystes"", which contains a precious item in it. When he looks at his chest, he sees within himself a faint flame, just as she said.<br><br>
It is in this way that his eternal struggle alongside the girl begins. <br><br>
(Source: AnimeNfo) ","Action, Comedy, Drama, Fantasy, Romance, Supernatural",24.0,2005-10-6,2006-3-23,70.0,85355,https://s4.anilist.co/file/anilistcdn/media/anime/cover/large/bx355-tB52QB38leMs.png
Fate/stay night,Fate/stay night,Fate/stay night,"Raised by a mysterious sorcerer after the death of his parents in a catastrophic fire, Shirou Emiya has only just begun to learn small tidbits of magic. When he is caught in a battle between two powerful Magi, however, he ends up performing a spell above his expected ability, accidentally summoning a beautiful woman knight to protect him. 
<br><br>
Shirou is thus unwillingly thrust into the competition known as the Holy Grail War where Seven Magi called Masters, together with their spirit partners called Servants, fight to acquire a powerful artifact said to grant every wish. 
","Action, Fantasy, Romance, Supernatural",24.0,2006-1-7,2006-6-17,68.0,160292,https://s4.anilist.co/file/anilistcdn/media/anime/cover/large/bx356-mTpMvtillumS.png
Himiko-Den,Legend of Himiko,火魅子伝,"High school student Himiko Himejima finds her life change forever when a mysterious flame appears before her one day. Along with her schoolmate Kutani Masahiko, Himiko is transported by the flame to an ancient kingdom known as Yamatai. The Yamatai kingdom has recently come under the attack of the Kune empire during its ritual to select a queen among six candidates. As the evil general of Kune creates an army of undead for power, the six queen candidates lead a resistance force to overthrow the Kune empire. Himiko and Kutani soon find themselves fighting alongside the queen candidates to save the kindgom. With some new-found power, Himiko and Kutani slowly realize their links to the ancient world and discover the power of the sacred flame.
<br><br>
(Source: Anime News Network)","Adventure, Drama, Fantasy, Supernatural",12.0,1999-1-7,1999-4-1,57.0,1484,https://s4.anilist.co/file/anilistcdn/media/anime/cover/large/bx360-aN0S0r2lbzC8.jpg
Gallery Fake,Gallery Fake,ギャラリーフェイク,"Fujita Reiji is the owner of an art gallery, Gallery Fake. He deals with fake items, and is also familiar with the black market. However, he has a special talent for art, and used to work for the Metropolitan Museum of Art in New York as a curator.<br><br>
(Source: Anime News Network)",Mystery,37.0,2005-1-8,2005-9-24,68.0,3739,https://s4.anilist.co/file/anilistcdn/media/anime/cover/large/bx364-kLB2uJHqXodf.jpg
Boogiepop wa Warawanai: Boogiepop Phantom,Boogiepop Phantom,ブギーポップは笑わない Boogiepop Phantom,"Five years ago, a string of grisly murders shook the city to its core and now the rumors have begun once more. Boogiepop... Everyone knows about Boogiepop: meet her one dark night and you are taken. People tell each other the stories and laugh: no one believes that she can possibly exist in this day and age. Still, strange things appear to be going on and the darkness is taking on many forms. Something is out there. Are you safe?<br><br>
(Source: RightStuf) ","Drama, Horror, Mystery, Psychological, Supernatural",12.0,2000-1-5,2000-3-22,70.0,36105,https://s4.anilist.co/file/anilistcdn/media/anime/cover/large/bx369-dwzXLDvzzAmK.png
BURN-UP EXCESS,Burn Up Excess,BURN-UP EXCESS,"Ready, aim, and fire up for another animated adventure with Team Warrior! Join rowdy Rio and her partners - the machine-gun maniac Maya, the lovely Lilica, tech talent Nanvel, guy friday Yuji, and their boss Maki - as they take on their hottest cases ever! Mechanical insects, firefighting jewel thieves, panty raiders, sexy sheiks, and fawning fathers - there's never a dull moment when the babes of <i>Burn Up Excess</i> are on the job!<br>
<br>
(Source: ADV Films)","Action, Adventure, Comedy, Ecchi, Sci-Fi",13.0,1997-12-12,1998-7-1,62.0,2698,https://s4.anilist.co/file/anilistcdn/media/anime/cover/large/nx370-j56XWmfJXKwo.jpg
Bannou Bunka Neko-Musume (1998),All Purpose Cultural Cat Girl Nuku Nuku TV,万能文化猫娘,"Each episode centers on Nuku Nuku's adventures and mishaps in high school, and her relationship to students, the overall series plot centers on the evil Mishima Industries' scheme to dominate the world through its products. In opposition to this plan are the slightly nutty Kyuusaku Natsume and Nuku Nuku, the android who acts as a companion to his young son. Nuku Nuku's classmates are all eccentrics, Futaba, the class president, is a domineering control-freak, who cannot leave her authority in school. Chieko Shirakaba is the rich snob with the two yes-girls who always take her side. There is a bookworm, a mystic, a scientist, and a pop singer. All of these are true to their descriptions: the mystic is always foretelling doom via tarot cards, spirits, or some other occult technique. The pop singer never says anything except as a song. The bookworm always has her nose in a book. These eccentricities add to the series' humor.
<br><br>
(Source: Anime News Network)","Action, Adventure, Comedy, Mecha, Sci-Fi",12.0,1998-1-7,1998-3-25,62.0,2472,https://s4.anilist.co/file/anilistcdn/media/anime/cover/large/bx375-bY7XEqX2oCIl.png
Heppoko Jikken Animation Excel Saga,Excel Saga,へっぽこ実験アニメーション エクセル・サーガ,"Excel Saga is a one-of-a kind work of art that can only be described as the ultimate parody of anime. From the opening credits - a rather odd spoof of Japanese pop videos - to the ending song featuring Menchi the dog singing/barking a plaintive ballad while a human interpreter translates for viewers, nothing is sacred in the world of Excel Saga.<br>
<br>
(Source: ADV Films)","Comedy, Sci-Fi",26.0,1999-10-8,2000-3-31,71.0,20125,https://s4.anilist.co/file/anilistcdn/media/anime/cover/large/bx379-qjgzMfG8vQAo.jpg
GANTZ,Gantz,GANTZ,"Thought your life was bad? Sometimes, death is worse. There is no salvation, peace, nor god waiting to receive you into their care. But wait, a god? Maybe you are talking about that big black ball stuck in the room with you. Now you are thrown into a game, fighting green aliens and robot monsters for the chance to survive.<br><br>
When Kei Kurono is killed, he thus finds himself caught in such a game; a test of his skills, morals and will to survive. His life is not his own, his death spat and trampled upon over and over again. What happens if he does not listen? God knows.<br><br>
A word of warning: Gantz is not for the faint-hearted, but neither is it as simple as it looks. Gore, rape and violence is rampant, as are portrayals of greed, violence, and all the ugliness that one sees in society today. <br><br>
[Written by MAL Rewrite]","Action, Drama, Ecchi, Horror, Psychological, Sci-Fi, Supernatural",13.0,2004-4-12,2004-6-22,64.0,52950,https://s4.anilist.co/file/anilistcdn/media/anime/cover/large/bx384-5vHimZPju1Wr.jpg
Gilgamesh,Gilgamesh,ギルガメッシュ,"After an explosion at an archaeological excavation research facility in the Middle East, the world is changed in unthinkable ways. The sky is suddenly a mirror, electronic devices mysteriously no longer work properly, and children who are born after this point seem to have strange, metaphysical powers. Society is but a shell of its former self, and in the midst of the clandestine forces that brought about this eerie apocalypse is an elite group of young, powerful mutants who are working to restore the world under the direction of a woman known only as The Countess.<br><br>
The story centers on a brother and sister, Tatsuya and Kiyoko, the children of a scientist at the Twin X facility.<br><br>
(Sources: Blockbuster &amp; ANN)","Drama, Fantasy, Sci-Fi",26.0,2003-11-2,2004-3-18,60.0,7948,https://s4.anilist.co/file/anilistcdn/media/anime/cover/large/bx385-Oc01usew504a.jpg
H2,H2,H2,"Hiro has two loves: baseball and porn, but due to an elbow injury, gives up baseball, choosing a school with no baseball team. His childhood friend Hikari attends a different school with baseball ace Hideo. The two of them wish that Hiro had not given up baseball. Hiro joins the soccer team and meets Haruka, a very clumsy girl who is also the daughter of his father's boss. Haruka is the manager of the unofficial baseball club at Hiro's school. When the soccer team challenges the baseball club to a game, with hopes of humiliating them, the baseball club nearly loses until Hiro, disgusted by the soccer team's arrogance, switches to the baseball club. <br><br>
(Source: Anime News Network)","Comedy, Romance, Sports",41.0,1995-6-1,1996-3-21,68.0,2847,https://s4.anilist.co/file/anilistcdn/media/anime/cover/large/bx386-8uZoKAYem0Kn.jpg
Haibane Renmei,Haibane Renmei,灰羽連盟,"A dream of falling from the sky... and then birth. Rakka is born from a large cocoon into the Old Home, greeted by a group of girls with small wings on their backs and shining halos above their heads. Soon Rakka&rsquo;s own wings grow, a halo is placed on her head and she is told that she must work in the nearby town of Grie. She soon realizes that the town and the entire world they live in are confined behind the Wall, a tall, impenetrable wall that none except the mysterious Toga are allowed to exit. <br><br>
(Source: Anime News Network) ","Drama, Fantasy, Mystery, Psychological, Slice of Life",13.0,2002-10-10,2002-12-19,79.0,78859,https://s4.anilist.co/file/anilistcdn/media/anime/cover/large/bx387-dS4aJivu0zPB.png
capeta,capeta,capeta,"Taira Kappeita, or Capeta, was a 4th grader boy. He had lost his mother when he had been very little. Although he pretended to be tough in front of his father, actually he felt lonely. One day, his father brought junk parts home from his workplace and made a racing cart. Soon, they went to a circuit to drive the cart. However, Capeta found that its frame was bent and it could hardly run straight. But, with his technique he managed the cart. Furthermore, he followed soon after the fast cart and he could nearly leave it behind. The driver in the cart was Minamoto Naomoi, the champion of the East Japan Junior Cart. Looking at their chase, Naomi&rsquo;s mother, Minamoto Nanako, advised Capeta to take part in the official race.
<br><br>
(Source: Anime News Network)","Drama, Sports",52.0,2005-10-4,2006-9-26,75.0,6205,https://s4.anilist.co/file/anilistcdn/media/anime/cover/large/bx388-4vycJx3nZhdF.png
Suzuka,Suzuka,涼風,"Yamato transfers to Aoba High and is quickly smitten with Suzuka, the school’s rising star of track and field. Unfortunately, she’s totally uninspired by Yamato’s irresponsible nature. When the young man decides to step it up and join the track team, even his best efforts might not measure up to Suzuka’s standards. Will he go the distance for love or will Suzuka have him running in circles? <br><br>
(Source: Crunchyroll)","Drama, Romance, Sports",26.0,2005-7-7,2005-12-29,67.0,18751,https://s4.anilist.co/file/anilistcdn/media/anime/cover/large/bx390-rO6Vj8DyKcLb.png
Yuu☆Yuu☆Hakusho,Yu Yu Hakusho: Ghostfiles,幽☆遊☆白書,"Urameshi Yusuke, 14 years of age, is about as troublesome and violent as teenagers come. He is constantly ditching school, causing trouble, and getting into numerous fights everyday. One day however, he does the unexpected, sacrificing himself to save a young child. Such an action, was never ever expected, especially coming from someone as troublesome as Urameshi Yusuke. The afterlife is not prepared for Yusuke, as they never thought he would make such a sacrifice. Nowhere to go, and dead, Yusuke becomes a ghost and must earn his way back into existence.<br><br>
Yusuke is ""employed"" by Koenma, who is in charge while his father and ruler of the afterlife, King Enma, is away. Under Koenma's command, Yusuke helps to stop menacing demons that threaten the lives of people everywhere; whether by stealing priceless and invaluable items and destructive weapons, or by wreaking havoc on humans everywhere.<br><br>
Throughout Yusuke's journey, he is usually joined by; his arch-rival, and local bully, Kuwabara Kazuma. He is also joined by two demons named Hiei and Kurama, whom are ex-convicts of the afterlife that managed to escape from Koenma.<br><br>
This group of unlikely allies goes on to participate and struggle in battles that have outcomes that determine the fate of humanity!<br><br>
(Source: AniDB) ","Action, Adventure, Comedy, Supernatural",112.0,1992-10-10,1995-1-7,82.0,135905,https://s4.anilist.co/file/anilistcdn/media/anime/cover/large/bx392-z90299zIvYmx.png
Ai Yori Aoshi: Enishi,Ai Yori Aoshi: Enishi,藍より青し～縁～,"Two years after meeting Aoi, Kaoru and gang are still up to their normal habits. Kaoru now in grad school and the tenants being as rowdy as ever what will become of Aoi and Kaoru's love.<br><br>
Two years has passed since Aoi and Kaoru were freed from the bonds of their families. They continue to live their normal lives with their usual friends in their house.","Comedy, Drama, Romance, Slice of Life",12.0,2003-10-13,2003-12-29,67.0,7915,https://s4.anilist.co/file/anilistcdn/media/anime/cover/large/bx394-tTgubslGwS5O.jpg
GANTZ 2,Gantz: Second Stage,GANTZ 2,"Kurono Kei and his ex-elementary school classmate, Kato Masaru have survived the first two ordeals that the unknown black sphere Gantz has sent them through. Exploding body parts, struggling to stay alive till the last seconds and seeing your fellow comrades fall in a pile of blood and gore are norm to them now. They are aware now that Gantz can call them up along with any new deeds, at any time for another confrontation with aliens.<br><br>
Will Kato's experiences in the Gantz world give him the same courage in the real world? With fellow veteran Gantzer Kei Kishimoto currently staying at Kurono's home as his ""adopted pet"", can Kurono stave off his growing lust for her mammaries?<br><br>
What the heck is Gantz?<br><br>
(Source: anime-source.com)","Action, Drama, Ecchi, Horror, Psychological, Sci-Fi, Supernatural",13.0,2004-8-26,2004-11-18,65.0,23457,https://s4.anilist.co/file/anilistcdn/media/anime/cover/large/bx395-vNu8TEbEL6qI.jpg
Seikai no Senki,Banner of the Stars,星界の戦旗,"Three years after their adventure, Lafiel becomes captain on the brand new assault ship Basroil and Jinto finishes his training to become a supply officer and joins Lafiels crew. They set out to join a large fleet with the mission of defending the strategically important Laptic Gate from a force 15 times larger than their own. And to bring even more worries, their new fleet commander is from the Bebous family, a family notorious for their ""Spectacular Insanity"". <br><br>
(Source: Anime News Network)","Action, Romance, Sci-Fi",13.0,2000-4-14,2000-7-14,73.0,7474,https://s4.anilist.co/file/anilistcdn/media/anime/cover/large/bx396-Lgdv4FWS5c1J.jpg
Seikai no Senki II,Banner of the Stars II,星界の戦旗 II,"Due to a lack of ambassadors for the recently-conquered worlds the rapidly advancing fleet of the Bebaus brothers leave behind, Lafiel is appointed Territorial Ambassador of the planet Lobnas II. Upon arriving to the planet Jinto and Lafiel discover that the planet was used by the United Mankind as a prison planet and now has a million prisoners on the only inhabited island. The prisoners are parted in three blocks. The western where women are housed, the eastern belongs to the men and the central is mixed under the restriction that all prisoners living there are sterilized. The women in the western sector want to emigrate from the planet of fear for the men and when they do the men in the east rebel, overthrowing the guards and capturing Jinto to try to stop the emigration of the women. At the same time an enemy fleet heads toward the system forcing Lafiel to abandon Jinto.<br><br>
(Source: Anime News Network)","Action, Romance, Sci-Fi",10.0,2001-7-11,2001-9-26,75.0,4909,https://s4.anilist.co/file/anilistcdn/media/anime/cover/large/bx397-mngW4FJxfPTl.png
Seihou Bukyou Outlaw Star,Outlaw Star,星方武侠アウトロースター,"Gene Starwind is a jack-of-all-trades responsible for odd jobs and bounty hunting with his partner, Jim Hawking. Stuck on a rundown planet, he’s going nowhere fast. But when a bodyguard job goes sideways, he finds himself the proud owner of the Outlaw Star and on an adventure to find the mysterious Galactic Leyline. Facing pirates and dangers galore, can he survive the journey through space?<br>
<br>
(Source: Crunchyroll)","Action, Adventure, Comedy, Sci-Fi",24.0,1998-1-8,1998-6-25,74.0,30418,https://s4.anilist.co/file/anilistcdn/media/anime/cover/large/bx400-CJ2duQT3dCX1.png
